id,created_at,text1034267331147571200,2018-08-28 02:32:02,b'How Robin Williams made one specific joke both funny and sad https://t.co/FJ29Tj9rEi'
1034263554541715456,2018-08-28 02:17:01,"b'RT @nytopinion: If Republicans retain control of both houses of Congress, we will become another Poland or Hungary faster than you can imag\xe2\x80\xa6'"
1034259785166794753,2018-08-28 02:02:03,"b""Read John McCain's farewell statement https://t.co/jLT6ftHf3t"""
1034257013998604288,2018-08-28 01:51:02,"b'RT @tripgabriel: Rep. Hunter, who sometimes visited a Capitol Hill bar multiple times a day, was part of a \xe2\x80\x98bro caucus\xe2\x80\x99 that @Boehner told\xe2\x80\xa6'"
1034254516466733056,2018-08-28 01:41:06,b'Did Juul try to lure teenagers to its sleek e-cigarettes and get customers for life? That question is at the heart\xe2\x80\xa6 https://t.co/oop5S2D5wX'
1034251775967145985,2018-08-28 01:30:13,"b'""The suspect clearly targeted other gamers."" The Jacksonville gunman walked past patrons before opening fire on pla\xe2\x80\xa6 https://t.co/qhqif9Rbd2'"
1034248459489079296,2018-08-28 01:17:02,"b'Matthew Broderick on Neil Simon: \xe2\x80\x9cI owe him a career"" https://t.co/63dv16X5qu'"
1034244702067982337,2018-08-28 01:02:06,"b""Evening Briefing: Here's what you need to know at the end of the day https://t.co/1J5Pz0vR7u"""
1034240921955721216,2018-08-28 00:47:05,"b'RT @PatriciaMazzei: What we learned Monday about the Jacksonville shooting, with @alanblinder and a big @nytimes team: https://t.co/hRMPsYG\xe2\x80\xa6'"
1034237141142908933,2018-08-28 00:32:04,b'Could Trump\xe2\x80\x99s missing signature force him to be deposed?\nhttps://t.co/BPkYmUR88u'
1034233365308878850,2018-08-28 00:17:04,"b'RT @NYTSports: ""It\'s like losing a family member."" Spurs guard Manu Ginobili is retiring after 16 seasons. @TheSteinLine talks to perhaps h\xe2\x80\xa6'"
1034229593086066689,2018-08-28 00:02:04,"b'North Carolina\xe2\x80\x99s congressional map was thrown out in federal court, again. Judges could order new districts to be d\xe2\x80\xa6 https://t.co/gcqW6205wk'"
1034225819634216960,2018-08-27 23:47:05,"b'Traces of marijuana can be found in breast milk up to 6 days after use, according to pediatricians. Experts have ca\xe2\x80\xa6 https://t.co/4VkzjZv3Nm'"
1034222044919951360,2018-08-27 23:32:05,b'Charles Kushner and Michael Cohen face scrutiny in New York for claims that they falsified construction permits in\xe2\x80\xa6 https://t.co/Ofotvc40l6'
1034218268892880897,2018-08-27 23:17:04,"b""RT @FrankBruni: Too many of the tributes to John McCain aren't really about John McCain. Then again too many of the tributes to Aretha Fran\xe2\x80\xa6"""
1034214500818345984,2018-08-27 23:02:06,b'Parting words from the student loan watchdog at the Consumer Financial Protection Bureau to Mick Mulvaney: \xe2\x80\x9cYou hav\xe2\x80\xa6 https://t.co/LdTe8tMbXJ'
1034210720961814528,2018-08-27 22:47:05,"b""Evening Briefing: Here's what you need to know at the end of the day https://t.co/oUozLIPHWA"""
1034206928400920576,2018-08-27 22:32:01,"b""Donna Shalala was an official in the Clinton administration, and ran 3 major universities. Now she's running for Co\xe2\x80\xa6 https://t.co/GBHNVezoTa"""
1034203170833018880,2018-08-27 22:17:05,b'President Trump touted the preliminary agreement with Mexico as a new trade pact that could replace Nafta and threa\xe2\x80\xa6 https://t.co/NfkJLbHizR'
1034199388845957120,2018-08-27 22:02:03,"b'A fatal shooting in Florida on Sunday thrust e-sports, a young and growing industry, into the national spotlight https://t.co/9fwI03CT7g'"
1034197543876419584,2018-08-27 21:54:43,"b'RT @jmartNYT: New: Trump has intervened in primaries like no other president.  \n\nHe is rewarding allies, forging new alliances and, most im\xe2\x80\xa6'"
1034194109819506689,2018-08-27 21:41:04,b'Is Rudy Giuliani shrewd or just \xe2\x80\x9cuntethered\xe2\x80\x9d? His strident defense of President Trump has left even old friends que\xe2\x80\xa6 https://t.co/PogfUYcb9y'
1034191794785972224,2018-08-27 21:31:52,"b'On today\'s episode of ""The Daily"": @mikiebarb, @BumillerNYT, @hillhulse, @MarkLandler and @ScottShaneNYT examine pi\xe2\x80\xa6 https://t.co/iYMkXhuIOk'"
1034188051323539459,2018-08-27 21:17:00,b'\xe2\x80\x9cThe Daily\xe2\x80\x9d from The New York Times takes you deeper into the stories of the moment with the journalists on the gro\xe2\x80\xa6 https://t.co/QgTx6MH0tL'
1034183815193931780,2018-08-27 21:00:10,b'This Sri Lankan coconut chicken curry with cashews goes together fairly quickly despite the long list of ingredient\xe2\x80\xa6 https://t.co/AJLZy5az9R'
1034180034792247303,2018-08-27 20:45:09,"b""Are small tweaks all that's needed to curb health care spending in the U.S.? A group of economists thinks so. https://t.co/dEhzJl7ggw"""
1034176261755740160,2018-08-27 20:30:09,"b'Personal finance management is a concrete, learnable skill, just like driving a car or throwing a baseball https://t.co/ndr86M0iEQ'"
1034172474529927168,2018-08-27 20:15:06,b'Can the president be impeached with the currently know facts from the Michael Cohen and Paul Manafort cases? And do\xe2\x80\xa6 https://t.co/FHiPOvDEuV'
1034168693205479424,2018-08-27 20:00:05,"b""Read John McCain's farewell statement https://t.co/joSMq9Iv61"""
1034164923486621697,2018-08-27 19:45:06,"b'*Steve Buscemi in ""30 Rock"" voice* \nHow do you do, fellow kids?\nhttps://t.co/rUDT9mE4BF'"
1034162415762657281,2018-08-27 19:35:08,"b'In 1998, a boy was found murdered in the Netherlands. Now 20 years later, and after 17,500 Dutchmen voluntarily too\xe2\x80\xa6 https://t.co/a8yweYXV9M'"
1034158774381096962,2018-08-27 19:20:40,"b""Florida's Democratic primary will set up one the most consequential governor\xe2\x80\x99s races in the country, in the nation\xe2\x80\x99\xe2\x80\xa6 https://t.co/T5yG5a47S3"""
1034156113414053889,2018-08-27 19:10:05,"b""Here's how to ask for that raise you've been waiting for https://t.co/Ye6hFhf1Il"""
1034152336644603910,2018-08-27 18:55:05,b'RT @nytopinion: Footage gathered by Rohingya refugees provides damning evidence of their genocide https://t.co/pCT2lXmUYG https://t.co/PbQS\xe2\x80\xa6'
1034148560730812417,2018-08-27 18:40:05,b'Why did the interview with Sarah Palin never air on Sacha Baron Cohen\xe2\x80\x99s \xe2\x80\x9cWho Is America?\xe2\x80\x9d Showtime isn\xe2\x80\x99t saying. https://t.co/YdVVPgn1SW'
1034144786738016258,2018-08-27 18:25:05,b'RT @nytimesarts: \xe2\x80\x9cI owe him a career.\xe2\x80\x9d \xe2\x80\x94 Matthew Broderick on Neil Simon https://t.co/RyKoFQLJtd'
1034141016679428102,2018-08-27 18:10:06,"b""Most homes in Barcelona are apartments, so the architect Guillermo Santom\xc3\xa0 wanted to preserve Casa Horta's identity\xe2\x80\xa6 https://t.co/LQCl4EFRuu"""
1034137228195389447,2018-08-27 17:55:03,"b'Patricia Clarkson on being stopped by people with ""Sharp Objects"" theories:\n""Oh, God. Oh, God. Oh, God. Oh, God. Oh\xe2\x80\xa6 https://t.co/Tc2AqbzVAP'"
1034133453254610945,2018-08-27 17:40:03,b'Endorsements from President Trump can effectively decide competitive primary races in the midterms. Some Republican\xe2\x80\xa6 https://t.co/d5Y1kShdJV'
1034129691777609729,2018-08-27 17:25:06,"b'A judge ruled that blueprints for 3D printed guns must stay off the internet for now, saying the First Amendment ri\xe2\x80\xa6 https://t.co/zXVXUFgnb6'"
1034125914932764672,2018-08-27 17:10:05,b'RT @TimHerrera: Being bad at money is sometimes viewed as a personal failing. And that\xe2\x80\x99s nonsense! If you were never taught money managemen\xe2\x80\xa6'
1034123447671169027,2018-08-27 17:00:17,"b'President Trump has threatened to take away the security clearance of Bruce Ohr, a career Justice Department offici\xe2\x80\xa6 https://t.co/fnUEUY6LZm'"
1034119636139368449,2018-08-27 16:45:08,b'How Robin Williams made one specific joke both funny and sad https://t.co/mbUXJukfv6'
1034115853317484546,2018-08-27 16:30:07,b'Did Juul try to lure teenagers to its sleek e-cigarettes and get customers for life? That question is at the heart\xe2\x80\xa6 https://t.co/954fWaCqsa'
1034112076661354499,2018-08-27 16:15:06,b'Underrepresented students are less likely to take the SATS more than once. But research shows that encouraging stud\xe2\x80\xa6 https://t.co/ge4ohSeGss'
1034108292061163520,2018-08-27 16:00:04,b'A doctor in Hong Kong has been accused of killing his wife and daughter with a yoga ball filled with carbon monoxide https://t.co/f2Cy2S5iOJ'
1034104534375825408,2018-08-27 15:45:08,b'The White House inexplicably flew the American flag at full-staff on Monday after lowering it on Sunday in honor of\xe2\x80\xa6 https://t.co/uiKx5SLj0k'
1034100494988464128,2018-08-27 15:29:05,"b'In Opinion\n\nAuthor Matt Welch writes, ""If we\xe2\x80\x99ve learned anything about the nature of government over the span of Jo\xe2\x80\xa6 https://t.co/9EeP8GeolQ'"
1034096976999211010,2018-08-27 15:15:06,b'The 96-year-old French painter and author Fran\xc3\xa7oise Gilot \xe2\x80\x94 famously known as the former lover and muse to Pablo Pi\xe2\x80\xa6 https://t.co/FW1sxyXXyf'
1034093246262267904,2018-08-27 15:00:17,"b'RT @amandahess: hello, here are three new episodes of INTERNETTING! https://t.co/hEphkdiNUY https://t.co/AhNAI7Ecre'"
1034089440594092033,2018-08-27 14:45:09,"b'""It\xe2\x80\x99s going to be decades in Arizona before we see another political figure with the international stature of John\xe2\x80\xa6 https://t.co/PY7GKmml3a'"
1034087779255369728,2018-08-27 14:38:33,b'Can the president be impeached with the currently know facts from the Michael Cohen and Paul Manafort cases? And do\xe2\x80\xa6 https://t.co/aAjThR480W'
1034085698482135040,2018-08-27 14:30:17,"b""The 2018 U.S. Open begins today. Follow along with day one's matches here: https://t.co/Vd3wqTrmLI"""
1034081875600584706,2018-08-27 14:15:06,"b'Kalashnikov, the rifle company, introduced a concept electric car that it said would compete with Tesla. But Russia\xe2\x80\xa6 https://t.co/bpHNEOF3n6'"
1034078115633541120,2018-08-27 14:00:09,b'The New York Times obituary for Neil Simon https://t.co/3lB3ah3pC3'
1034074321549967360,2018-08-27 13:45:05,"b'RT @MarkLandler: As flag over the WH hangs at full staff, \xe2\x81\xa6@juliehdavis\xe2\x81\xa9 on how Trump\xe2\x80\x99s refusal to honor John McCain shows he is \xe2\x80\x9cunwilling\xe2\x80\xa6'"
1034072840125988864,2018-08-27 13:39:11,b'Breaking News: The U.S. and Mexico reached a preliminary agreement to revise key portions of Nafta. The trade deal\xe2\x80\xa6 https://t.co/iSq1zb2fER'
1034070569036251136,2018-08-27 13:30:10,b'Joe Arpaio got a presidential pardon and parlayed it into a Senate campaign in Arizona. But the sheriff may be ente\xe2\x80\xa6 https://t.co/Rujiv0DrSk'
1034066784754847744,2018-08-27 13:15:08,"b'Here\xe2\x80\x99s everything that we now know \xe2\x80\x94 and don\xe2\x80\x99t \xe2\x80\x94 about President Trump\xe2\x80\x99s $130,000 deal with Stormy Daniels https://t.co/IS5D5OduBs'"
1034063046451322882,2018-08-27 13:00:16,"b""John McCain was proud of his reputation as a maverick in American politics. Here's a look at the senator's complex\xe2\x80\xa6 https://t.co/CfHZWzOCWY"""
1034059241684979712,2018-08-27 12:45:09,"b""Morning Briefing: Here's what you need to know to start your Monday https://t.co/uVR4Rm8d5e"""
1034055472540737536,2018-08-27 12:30:11,"b'An old-fashioned, non-digital paper planner. Scissors. A great pen. Choose the right kind of each one, and life is\xe2\x80\xa6 https://t.co/0E6hs6CaGa'"
1034051703664992257,2018-08-27 12:15:12,"b'As President Trump faces his own legal troubles, he has taken to using a vocabulary that sounds uncannily like that\xe2\x80\xa6 https://t.co/X4Ffm8M8oS'"
1034048535883403264,2018-08-27 12:02:37,b'RT @NYTSports: 20-year-old Naomi Osaka is one of the most intriguing young stars in sports today: an athlete who grew up in one place (the\xe2\x80\xa6'
1034044148687491073,2018-08-27 11:45:11,b'Black men have the lowest life expectancy of any ethnic group in the United States. Researchers believe it may be b\xe2\x80\xa6 https://t.co/Y90gdLdpZM'
1034039779397169153,2018-08-27 11:27:49,b'Your saliva might help you learn to eat your greens https://t.co/5mkDuPzDcV'
1034035407049109504,2018-08-27 11:10:27,"b'This farro with salmon, cucumber, radicchio and dill recipe goes from crunchy cool to warm and comforting in every\xe2\x80\xa6 https://t.co/CZU2GAZEnV'"
1034031055962087424,2018-08-27 10:53:09,"b'The pan-fried zucchini planks in this marinated zucchini with farro, chickpeas and parmesan recipe will add extra c\xe2\x80\xa6 https://t.co/ZH2c0FK4NE'"
1034026809577418752,2018-08-27 10:36:17,"b'Bill Cunningham, for many years the fashion and society photographer for The Times, left a memoir behind when he di\xe2\x80\xa6 https://t.co/Db2csht5rt'"
1034022737076019200,2018-08-27 10:20:06,b'Sketchbook: Back-to-School Blues https://t.co/WI6qiuDr2G'
1034021529246420994,2018-08-27 10:15:18,"b""The current home of the U.S. Open started out as a derelict relic of the 1964 World's Fair. Now it's a state-of-the\xe2\x80\xa6 https://t.co/hPQYmto7wx"""
1034021389488017408,2018-08-27 10:14:45,b'The West Bank Model Is a Failure https://t.co/vaZopeMe2P'
1034017727940308992,2018-08-27 10:00:12,"b""Almost everyone involved in Job Corps questions whether it's living up to its ideals, with an outdated program mode\xe2\x80\xa6 https://t.co/5X1HtTY8WK"""
1034013924964921344,2018-08-27 09:45:05,"b'Police say a man shot last month in the Bronx is an associate of a well-known mafia family. ""The fact that they are\xe2\x80\xa6 https://t.co/k0LOXf7PwC'"
1034010140012425217,2018-08-27 09:30:03,"b'John McCain will be the 13th former senator to lie in state at the Capitol Rotunda, and will  have a full dress fun\xe2\x80\xa6 https://t.co/SXzzFbsIwZ'"
1034006158560972801,2018-08-27 09:14:13,b'Myanmar\xe2\x80\x99s army commander and other top generals should face trial for genocide against Rohingya Muslims and for cri\xe2\x80\xa6 https://t.co/dhpLhJMwk4'
1034002711593865218,2018-08-27 09:00:31,"b'Myanmar Generals Should Face Genocide Charges, U.N. Panel Says https://t.co/rbqNgAPIeS'"
1034002610221707264,2018-08-27 09:00:07,"b'In his decision to keep Tesla public, Elon Musk cited 4 key factors that ultimately changed his mind. https://t.co/f96iF47m9h'"
1034001447980093440,2018-08-27 08:55:30,b'The Checkup: Let Kids Play https://t.co/cHckYawRrY'
1033998823914446848,2018-08-27 08:45:05,b'Some demonstrators carried signs condemning racism; others had draped themselves in Confederate flags https://t.co/xflAI57g6o'
1033995040669028352,2018-08-27 08:30:03,b'A live-stream caught the chilling moment when the shooting began. A red laser dot appeared on the chest of one of t\xe2\x80\xa6 https://t.co/f7MHpaEHV4'
1033991267015950336,2018-08-27 08:15:03,"b'In @NYTOpinion \n\nOp-Ed contributor Elizabeth Guffey writes, ""This month, the \'wheelchair symbol,\' formally known as\xe2\x80\xa6 https://t.co/i1eeLrWf3V'"
1033987490615619585,2018-08-27 08:00:02,b'A contentious exhibition has cast a spotlight on the battle over gay and transgender rights in Brazil https://t.co/lhX2X0V4y2'
1033983721945358336,2018-08-27 07:45:04,"b'These balls of algae are considered a national treasure in Japan, and many things about them remain mysterious. But\xe2\x80\xa6 https://t.co/PtVMGMLDp6'"
1033979960032153601,2018-08-27 07:30:07,"b'Personal finance management is a concrete, learnable skill, just like driving a car or throwing a baseball https://t.co/iWhKx8nIkL'"
1033976168146501638,2018-08-27 07:15:03,"b""An archbishop's allegations and personal attacks amounted to an extraordinary public declaration of war against Pop\xe2\x80\xa6 https://t.co/bp6RxVc7si"""
1033972405994225664,2018-08-27 07:00:06,"b'Your European Morning Briefing is ready: Pope Francis is accused, Russia prepares to go nuclear offshore, Denmark c\xe2\x80\xa6 https://t.co/TaCCYsY312'"
1033968616759349249,2018-08-27 06:45:03,"b'The German Lost Art Foundation, praised often for helping return art lost in the Holocaust, is facing criticism fro\xe2\x80\xa6 https://t.co/IqWLgfW6z8'"
1033965252805709824,2018-08-27 06:31:41,"b""RT @EllenBarryNYT: If you're not sure why Pope Francis is apologizing to Ireland, read this painful @DanBarryNYT piece on single mothers wh\xe2\x80\xa6"""
1033964854401544192,2018-08-27 06:30:06,"b'It is finally time for the night owls of the world to rise! (Just not too early, of course.) https://t.co/vo2CNixvCi'"
1033961076826820608,2018-08-27 06:15:05,"b""Writers, actors and others took to social media to remember Neil Simon's life and influence https://t.co/upXX3Vz4IF"""
1033957317581131776,2018-08-27 06:00:09,b'*plays Fergie* G-L-A-M-O-R-O-U-S https://t.co/Yeo7QaFqxm'
1033953533190721536,2018-08-27 05:45:06,b'Russia is unveiling a floating nuclear power plant that is for now the only one of its kind https://t.co/L8AMNwvtAm'
1033949771441102849,2018-08-27 05:30:10,b'Australia\xe2\x80\x99s new prime minister speaks often and openly about his Christian faith \xe2\x80\x94 a rarity among Australian politi\xe2\x80\xa6 https://t.co/44dv8jtQYJ'
1033945977902821376,2018-08-27 05:15:05,b'A Japanese tourist in North Korea was detained after apparently filming footage of a military facility in the area https://t.co/eYYSl14wb5'
1033942204463628289,2018-08-27 05:00:05,"b'A.E. Hotchner, the man who was everybody\xe2\x80\x99s best friend \xe2\x80\x94 Ernest Hemingway\xe2\x80\x99s, anyway, and Paul Newman\xe2\x80\x99s \xe2\x80\x94 wrote his\xe2\x80\xa6 https://t.co/YVeTUUbOGc'"
1033938415492972544,2018-08-27 04:45:02,"b'Brands are reintroducing products for new generations. \xe2\x80\x9cWhat\xe2\x80\x99s old is new again."" https://t.co/YpQWhHpJik'"
1033934669190979585,2018-08-27 04:30:09,"b'""It\xe2\x80\x99s like Jekyll and Hyde.\xe2\x80\x9d Duncan Hunter boasted a glittering political resume, but a corruption scandal could ho\xe2\x80\xa6 https://t.co/AirjOvslGG'"
1033930872892874753,2018-08-27 04:15:04,"b'\xe2\x80\x9cThis is very unusual in Chicago,\xe2\x80\x9d a Fire Department spokesman said. \xe2\x80\x9cWe\xe2\x80\x99re going the wrong way fast, and it\xe2\x80\x99s very\xe2\x80\xa6 https://t.co/KR9pYG34cI'"
1033927117329915904,2018-08-27 04:00:08,"b'""Crazy Rich Asians"" had a decrease of only 6 percent in ticket sales compared to its opening weekend. That kind of\xe2\x80\xa6 https://t.co/YET4PzQUWM'"
1033923324722728965,2018-08-27 03:45:04,"b'In a memo, Defense Secretary Jim Mattis urged President Trump to build a national strategy for A.I. that matches th\xe2\x80\xa6 https://t.co/hWyIum5Jc7'"
1033919886538534913,2018-08-27 03:31:24,"b'In Brazil, \xe2\x80\x98Queer Museum\xe2\x80\x99 Is Censored, Debated, Then Celebrated https://t.co/yj3I4g1g6J'"
1033916429995847680,2018-08-27 03:17:40,"b'Alice Dunnigan, the first black woman to cover the White House, will be honored with a bronze statue at the Newseum https://t.co/8T15ZmrGEf'"
1033912003776139265,2018-08-27 03:00:05,"b'A nationwide prisoner strike is drawing attention to low inmate wages, decrepit facilities and harsh sentences. \xe2\x80\x9cPe\xe2\x80\xa6 https://t.co/FH55aC58sO'"
1033908217200427008,2018-08-27 02:45:02,"b""President Trump didn't make even the most cursory public show of respect for John McCain, against whom he had conti\xe2\x80\xa6 https://t.co/6VX8qrIxdI"""
1033904824331526144,2018-08-27 02:31:33,b'The Nuclear Power Plant of the Future May Be Floating Near Russia https://t.co/8TA8ck1eGH'
1033904419849596929,2018-08-27 02:29:57,"b'""Let the obvious sit too long and it becomes like an animal in a zoo: pointed at, but never exercised, and idly wan\xe2\x80\xa6 https://t.co/vRsvmhT0DV'"
1033900164472348673,2018-08-27 02:13:02,"b'How does a movie or TV show prevent a steamy scene from becoming a #MeToo experience for the actors? Enter the ""int\xe2\x80\xa6 https://t.co/8GSStJKvhM'"
1033896144466784257,2018-08-27 01:57:04,"b'""I prefer the early plays,"" our critic writes about Neil Simon\'s work. ""That\xe2\x80\x99s in part because they literally don\xe2\x80\x99t\xe2\x80\xa6 https://t.co/dmKywcnDlY'"
1033892736104058880,2018-08-27 01:43:31,b'North Korea to Expel a Japanese Tourist Accused of Crime https://t.co/ZfFyHRgNFq'
1033888684507058176,2018-08-27 01:27:25,"b'As a Nation Mourns McCain, Trump Is Conspicuously Absent https://t.co/oej85plXWD'"
1033885967042715648,2018-08-27 01:16:37,"b""Open floor plan offices can be a challenge. Here's how to make your work space a bit more bearable. https://t.co/sUG75mhvwC"""
1033881832968859648,2018-08-27 01:00:12,b'The number of individuals who sleep less than the recommended hours is increasing in the developed world. This is c\xe2\x80\xa6 https://t.co/90thyHlr4I'
1033878129637568512,2018-08-27 00:45:29,b'Your toilet isn\xe2\x80\x99t a garbage can https://t.co/LV6rS344g7'
1033873877439578112,2018-08-27 00:28:35,b'Opera of Demons https://t.co/ZX311TjNY5'
1033871362992078849,2018-08-27 00:18:35,"b'An Appraisal: Neil Simon Drew Big Laughs, Then Came a Cultural Shift https://t.co/KGxii8a7UJ'"
1033871354083401728,2018-08-27 00:18:33,b'Artificial Intelligence Is Now a Pentagon Priority. Will Silicon Valley Help? https://t.co/TsNFSJyEr4'
1033866712494604289,2018-08-27 00:00:07,b'Here are books for kids who might find some comfort knowing that other students (and dinosaurs and stick insects) g\xe2\x80\xa6 https://t.co/F0fu17vkQM'
1033863831838224385,2018-08-26 23:48:40,"b'Capitalism, Socialism, and Unfreedom https://t.co/HoL30yUS1B'"
1033859643863445504,2018-08-26 23:32:01,b'Prison Strike Organizers Aim to Improve Conditions and Pay https://t.co/lO3dWWSQIX'
1033855658142167041,2018-08-26 23:16:11,b'My WORKOUT: How One Silicon Valley C.E.O. Masters Work-Life Balance https://t.co/NH84Cqo2hI'
1033852613240995840,2018-08-26 23:04:05,b'John McCain\xe2\x80\x99s Parting Message: Our Greatness Is in Peril https://t.co/kkoTHUMnWe'
1033852431162122246,2018-08-26 23:03:22,"b""With Republicans clinging to a 50-49 Senate majority, the Arizona governor's choice for John McCain's successor has\xe2\x80\xa6 https://t.co/UQ6rDO682q"""
1033851610957590534,2018-08-26 23:00:06,"b'""It\'s literally the warehousing of human beings \xe2\x80\x94 like they were packages to be shipped off."" A look at the ""stash\xe2\x80\xa6 https://t.co/i6r3yCmZpj'"
1033848729147727872,2018-08-26 22:48:39,"b'Night owls of the world unite. In a 24-hour economy, what if going to bed in the wee hours is actually an advantage? https://t.co/rqct1lLJH1'"
1033845061933514754,2018-08-26 22:34:05,"b'In @nytopinion,\nOp-Ed contributor Miriam Pawel writes, ""Not every believer in the Party of California has been a gr\xe2\x80\xa6 https://t.co/xJjmPbD3zT'"
1033843425500717056,2018-08-26 22:27:35,b'RT @PatriciaMazzei: Our running @nytimes story on the mass shooting at the Jacksonville Landing: https://t.co/Efl9De2gDs'
1033832753157087232,2018-08-26 21:45:10,"b""Catch up on the latest news about Elon Musk, John McCain's death, and other top stories, and get a look ahead, in y\xe2\x80\xa6 https://t.co/Dlec9YkqO2"""
1033826838500581376,2018-08-26 21:21:40,b'RT @EricLiptonNYT: FOLLOW ALONG HERE--IT YOU EAT FRUIT &amp; VEGETABLES. My colleague @dannyhakim and I took a deep journey this summer into th\xe2\x80\xa6'
1033821438430642176,2018-08-26 21:00:13,"b'Glenn Close says she went into her latest role, a woman who spends her life as a self-described ""kingmaker"" to her\xe2\x80\xa6 https://t.co/x2NXBuUlXz'"
1033817631449640960,2018-08-26 20:45:05,"b'Police say a man shot last month in the Bronx is an associate of a well-known mafia family. ""The fact that they are\xe2\x80\xa6 https://t.co/O3BouYHitn'"
1033815605332332549,2018-08-26 20:37:02,"b'RT @nytimesbusiness: ""Dots don\'t matter"" in Gmail addresses, and plus signs have their pluses. Here\'s how to get more out of your Google ma\xe2\x80\xa6'"
1033811380116357122,2018-08-26 20:20:14,"b'A few of the things prosecutors say Rep. Duncan Hunter bought with campaign funds: $14,261.33 family vacation to It\xe2\x80\xa6 https://t.co/ohnn6WTYCb'"
1033807065444167680,2018-08-26 20:03:06,"b'Here are 13 great titles leaving Netflix in September, including classics like ""A Star is Born"" and modern gems you\xe2\x80\xa6 https://t.co/RnOFoD3sfN'"
1033803783145447430,2018-08-26 19:50:03,"b'In Opinion\n\nAuthor Jonathan Rauch writes, \xe2\x80\x9cLike it or not, inequality in today\xe2\x80\x99s America drives politics toward rag\xe2\x80\xa6 https://t.co/YBVezMkom2'"
1033800282378002433,2018-08-26 19:36:09,"b'Multiple people are dead after a gunman started firing during a video gaming tournament in Jacksonville, Florida, a\xe2\x80\xa6 https://t.co/m5ErhC8tHC'"
1033799147311308800,2018-08-26 19:31:38,b'Residents of the village with the smallest population in Switzerland wonder if nostalgic tourists and hikers attrac\xe2\x80\xa6 https://t.co/AWI8LgFFWk'
1033795270520254467,2018-08-26 19:16:14,"b""The current home of the U.S. Open started out as a derelict relic of the 1964 World's Fair. Now it's a state-of-the\xe2\x80\xa6 https://t.co/J5LAJZAnOd"""
1033791255774461957,2018-08-26 19:00:16,b'RT @NYTSports: U.S. Open players \xe2\x80\x94 and fans \xe2\x80\x94 share their favorite memories from the tournament https://t.co/fsF9v6LDN6 https://t.co/bYSdG9\xe2\x80\xa6'
1033788898462326785,2018-08-26 18:50:54,b'Authorities report a mass shooting at a Florida bar that was hosting a live-streamed video gaming tournament. https://t.co/suuG1i7rUk'
1033787430124576770,2018-08-26 18:45:04,"b""Almost everyone involved in Job Corps questions whether it's living up to its ideals, with an outdated program mode\xe2\x80\xa6 https://t.co/6nZ9k9akzB"""
