id,created_at,text1037005767864406016,2018-09-04 15:53:36,"b'Breaking News: Amazon just became the second American company with a $1 trillion valuation, after Apple. But its ro\xe2\x80\xa6 https://t.co/6LANLe6rEB'"
1037004383370850304,2018-09-04 15:48:06,"b'Cher on Cher: ""I\'ve never been a huge Cher fan"" https://t.co/Oj5s9muSfC'"
1037001865739882497,2018-09-04 15:38:06,b'Alex Jones said being banned from YouTube and Facebook would strengthen him. He was wrong. https://t.co/2Vy00xXP7R'
1036999332866781184,2018-09-04 15:28:02,"b'RT @NYTMetro: ""I\'m my own person, very much my own person,"" Chirlane McCray said of her decision to make an endorsement for attorney genera\xe2\x80\xa6'"
1036996818297659393,2018-09-04 15:18:02,"b'In offering civil rights protections to a new set of groups, the Justice Department has lifted protections for othe\xe2\x80\xa6 https://t.co/UbSprpMnps'"
1036994297344806912,2018-09-04 15:08:01,"b'RT @joecoscarelli: DIARY OF A SONG, EP. 2: \xe2\x80\x9cMo Bamba\xe2\x80\x9d by Sheck Wes \n\xf0\x9f\x98\x88\xf0\x9f\x8f\x80\xf0\x9f\x98\x88\xf0\x9f\x8f\x80\xf0\x9f\x98\x88\xf0\x9f\x8f\x80\xf0\x9f\x98\x88\n\nhow a one-take freestyle uploaded to SoundCloud on a whim beco\xe2\x80\xa6'"
1036991783509606400,2018-09-04 14:58:02,b'Tropical Storm Gordon is poised to become the first hurricane to threaten the continental U.S. this year  https://t.co/GDplfKkQLF'
1036989273680084993,2018-09-04 14:48:03,b'The head of USA Gymnastics was forced to resign. She was criticized for the way she handled the sexual abuse scanda\xe2\x80\xa6 https://t.co/bLZo9Yr8tt'
1036987522914635777,2018-09-04 14:41:06,"b'RT @NYTSports: As tennis players get taller, the shorter players look for ways to take advantage. https://t.co/u8IqwFlyYe'"
1036984230885113857,2018-09-04 14:28:01,"b'Alex Jones and other large-scale purveyors of inflammatory speech have been taking to private Facebook groups, wher\xe2\x80\xa6 https://t.co/AXDBgrOcSQ'"
1036983358092451840,2018-09-04 14:24:33,b'Brett Kavanaugh\xe2\x80\x99s hearing before the Senate Judiciary Committee began with a bang. Watch live here: https://t.co/BeSoXkduvV'
1036981800231481345,2018-09-04 14:18:22,b'RT @adamliptak: I\xe2\x80\x99ve covered five other Supreme Court confirmation hearings.  None of them included anything like the chaos in the opening\xe2\x80\xa6'
1036981727837802498,2018-09-04 14:18:04,"b'""Bears aren\'t idiots,"" said Vladimir Putin\'s press secretary. ""If they see Putin, they will behave properly."" https://t.co/dS9NFNPqgA'"
1036979902791249921,2018-09-04 14:10:49,"b'The moment Brett Kavanaugh\xe2\x80\x99s confirmation hearing opened, Democrats and protesters turned it into a verbal brawl  https://t.co/hIwtLyHU95'"
1036977196622131200,2018-09-04 14:00:04,"b'RT @jdelreal: I traveled up to the California-Oregon border for my latest piece, where ecological strain on the Klamath River has stirred a\xe2\x80\xa6'"
1036973436109770752,2018-09-04 13:45:07,"b""Chinese news outlets and social media users were consumed by details of Richard Liu's arrest. His mug shot, taken b\xe2\x80\xa6 https://t.co/kWHhxvvcPS"""
1036969664172183554,2018-09-04 13:30:08,"b'Randy Credico, a comedian and left-wing political activist, has an appointment on Friday. With Robert Mueller. Befo\xe2\x80\xa6 https://t.co/xhP6suXwaU'"
1036965606766116870,2018-09-04 13:14:01,"b'""Caning is a form of torture, and to inflict this brutal punishment publicly on two people for engaging in consensu\xe2\x80\xa6 https://t.co/rfGPaI5X1w'"
1036962158536531968,2018-09-04 13:00:19,"b""Morning Briefing: Here's what you need to know to start your day https://t.co/7PYbGjzvwn https://t.co/XMCq4Rpty6"""
1036959899253661696,2018-09-04 12:51:20,"b'""It\'s perfect."" A rap recorded by four virtual strangers in 20 minutes went from internet obscurity to Shaq\'s Insta\xe2\x80\xa6 https://t.co/iJc3B44eo6'"
1036958068565794816,2018-09-04 12:44:03,"b""Judge Kavanaugh\xe2\x80\x99s confirmation hearing comes amid deep partisan division between Republicans and Democrats. Here's\xe2\x80\xa6 https://t.co/3XBUJhQdw3"""
1036957088583491584,2018-09-04 12:40:10,"b'Nike\xe2\x80\x99s decision to make new Kaepernick merchandise and to make him the face of a campaign could, if they are succes\xe2\x80\xa6 https://t.co/de56AcaTUO'"
1036954801689571328,2018-09-04 12:31:05,"b'""I don\'t know, for some reason, I just struggled in the conditions tonight. It\xe2\x80\x99s one of the first times it\'s happen\xe2\x80\xa6 https://t.co/G4qwYhW0eR'"
1036950785920303105,2018-09-04 12:15:07,b'RT @cliffordlevy: A black restaurant owner in Harlem says he tried assisting a white patron in distress. \nCops arrested him.\nhttps://t.co/F\xe2\x80\xa6'
1036946997960429568,2018-09-04 12:00:04,"b""Your daily @DealBook Briefing:\n\n\xe2\x80\xa2 Tech's tensions with government may be a big problem.\n\n\xe2\x80\xa2 It's Nike vs. the NFL ov\xe2\x80\xa6 https://t.co/wmPx0pgROs"""
1036944733560598528,2018-09-04 11:51:04,"b'Thirteen years ago, the red-sequined heels from the ""Wizard of Oz"" were mysteriously stolen. Now they have been fou\xe2\x80\xa6 https://t.co/ruidS8PxbQ'"
1036943229546123264,2018-09-04 11:45:06,b'The discord between NBC News and Ronan Farrow went public on Monday night https://t.co/W0UOMn4tvM'
1036939455146459136,2018-09-04 11:30:06,"b'Steve Bannon was dropped as a headliner at The New Yorker Festival on Monday evening after John Mulaney, Judd Apato\xe2\x80\xa6 https://t.co/rhm8IeXJtN'"
1036936933736411136,2018-09-04 11:20:05,b'Thanks to ruthless discipline \xe2\x80\x94 and a project long in the making \xe2\x80\x94 the Republican Party is tilting federal benches\xe2\x80\xa6 https://t.co/InTdywcSeH'
1036934419209236481,2018-09-04 11:10:05,b'Will an underdog upset a 10-term congressman? Which Republican will face Senator Elizabeth Warren in November? The\xe2\x80\xa6 https://t.co/SFllHthsrL'
1036931933081690112,2018-09-04 11:00:12,b'Republicans will present Judge Kavanaugh to the nation as an advocate and mentor for women in the judiciary. Democr\xe2\x80\xa6 https://t.co/HiRhFdOpRw'
1036929374124208128,2018-09-04 10:50:02,"b'Rodrigo Duterte has ordered the arrest of Antonio Trillanes, one of his most prominent critics in the Philippine Se\xe2\x80\xa6 https://t.co/Mq4QEWJTKs'"
1036927106951905280,2018-09-04 10:41:02,"b'Pakistan\xe2\x80\x99s powerful military has quietly reached out to its archrival India about resuming peace talks, but the res\xe2\x80\xa6 https://t.co/yPoNdCyTK0'"
1036924352007233537,2018-09-04 10:30:05,"b'Typhoon Jebi, the strongest storm to hit Japan in 25 years, made landfall on a southeastern island early Tuesday af\xe2\x80\xa6 https://t.co/Fm8yeYhGF7'"
1036920580283478016,2018-09-04 10:15:06,"b""Morning\xc2\xa0Briefing: Here's what you need to know to start your day https://t.co/headeDdVhD https://t.co/1lP6h5q1UP"""
1036916853380206592,2018-09-04 10:00:17,"b'\xe2\x80\x9cEvery time I make a record, I forget everything I\xe2\x80\x99ve learned about how to make a record"" https://t.co/bOQbaivGSL'"
1036912772276207617,2018-09-04 09:44:04,b'The sea journey between North Africa and Italy is now deadlier than at any point since the peak of the European mig\xe2\x80\xa6 https://t.co/JeJZeE40ef'
1036909268514091008,2018-09-04 09:30:09,"b'Sweden ""is joining the rest of Europe,"" Carl Bildt, a former prime minister, said with evident sadness. ""And the my\xe2\x80\xa6 https://t.co/g3KUbBlgzy'"
1036905722326528000,2018-09-04 09:16:03,"b'""It\'s a moment of intense pain,"" said a paleoartist at the National Museum of Brazil. ""We can only hope to recover\xe2\x80\xa6 https://t.co/kZAV9Kj46E'"
1036901710818668544,2018-09-04 09:00:07,b'Why do so many husbands feel the need to boast about completing simple household chores? https://t.co/IvPPfZMQic'
1036897932920926208,2018-09-04 08:45:06,"b'In May, BTS became the first K-pop group to reach No. 1 on the Billboard album chart. For the second time in 6 mont\xe2\x80\xa6 https://t.co/7TV9kjUwEH'"
1036894152942936066,2018-09-04 08:30:05,"b'By manipulating DNA, researchers are trying to create microbes that, once ingested, work to treat a rare genetic co\xe2\x80\xa6 https://t.co/JYeSwYREoL'"
1036890370070724609,2018-09-04 08:15:03,"b'As militias fight in Libya, Facebook has been used to sow ethnic hatred, track down enemies, trade military-grade w\xe2\x80\xa6 https://t.co/nmpM8dNhUX'"
1036886626834833408,2018-09-04 08:00:10,"b'\xe2\x80\x9cNamaste,\xe2\x80\x9d says Amazon, as it unveils a Hindi-language version of its service to compete in India, home to the worl\xe2\x80\xa6 https://t.co/yeBHNzWxVP'"
1036882830247297024,2018-09-04 07:45:05,b'President Trump\xe2\x80\x99s economy has left the most distressed swaths of the country waiting for their share of the good ti\xe2\x80\xa6 https://t.co/0cYuOPOQBC'
1036879063363846144,2018-09-04 07:30:07,"b'""The cookies that called to me were so distinctive that even though they were on a back counter, I spotted them thr\xe2\x80\xa6 https://t.co/NeRPCuYlZg'"
1036875409210597376,2018-09-04 07:15:36,"b""Steve Bannon's appearance at the New Yorker Festival was canceled after several high-profile celebrities dropped ou\xe2\x80\xa6 https://t.co/UCBBLrPj5n"""
1036874371103637505,2018-09-04 07:11:28,"b'\xe2\x80\x9cThe suggestion to take the story to another outlet was first raised by NBC, not me,\xe2\x80\x9d Ronan Farrow said about his r\xe2\x80\xa6 https://t.co/SC7KTCHn8b'"
1036867733026234368,2018-09-04 06:45:06,b'There is a real danger in letting politics undermine the storied relationship between the government and Silicon Va\xe2\x80\xa6 https://t.co/UjFSCn6uD4'
1036863973021364224,2018-09-04 06:30:09,b'About half of menopausal women suffer from vaginal dryness and painful intercourse. Yet less than half of those wom\xe2\x80\xa6 https://t.co/wCjzW7uYJ1'
1036860196709130240,2018-09-04 06:15:09,"b'Amazon is quickly gathering momentum in online advertising, where it is rapidly emerging as a major competitor to G\xe2\x80\xa6 https://t.co/HRvc6jVsUZ'"
1036856439741001729,2018-09-04 06:00:13,"b""It's been 4 years since 43 students protesters were pulled off buses in southern Mexico, never to be seen again. So\xe2\x80\xa6 https://t.co/vmW4MLPAE5"""
1036852636853653504,2018-09-04 05:45:07,"b'In Opinion\n\nOp-Ed contributor Debbie Weingarten writes, ""In the case of both of my children, the \xe2\x80\x9cdocument\xe2\x80\x9d that do\xe2\x80\xa6 https://t.co/qckfl7Vjiu'"
1036848867122274305,2018-09-04 05:30:08,"b'54 percent of Oregon\xe2\x80\x99s House Democrats now are female, a rare majority in state capitols, where men still mostly ru\xe2\x80\xa6 https://t.co/GL9wWBNAy2'"
1036845089820237824,2018-09-04 05:15:07,"b'Alex Jones, the founder of Infowars, and other large-scale purveyors of inflammatory speech have found refuge in pr\xe2\x80\xa6 https://t.co/trfmbzgcjW'"
1036841297389207553,2018-09-04 05:00:03,"b'From the garden section at Walmart to the diamond counters at Tiffany &amp; Company, old-school retailers are experienc\xe2\x80\xa6 https://t.co/Lhiliiuzd7'"
1036839846508150784,2018-09-04 04:54:17,b'Roger Federer is out of the U.S. Open after a 4th-round loss to John Millman. It\xe2\x80\x99s his earliest exit from a major t\xe2\x80\xa6 https://t.co/uw93gF6Ppd'
1036837542820278272,2018-09-04 04:45:08,b'A case that was originally about Colin Kaepernick\xe2\x80\x99s skills has turned into something much larger: a referendum on h\xe2\x80\xa6 https://t.co/sFILogTnXk'
1036833764054368256,2018-09-04 04:30:07,"b'Speaking at the Vatican, Pope Francis said, ""May the Lord give us the grace to discern when we should speak and whe\xe2\x80\xa6 https://t.co/d0ABI6gnkE'"
1036831222813655041,2018-09-04 04:20:01,"b'\xe2\x80\x9cCaning is a form of torture, and to inflict this brutal punishment publicly on two people for engaging in consensu\xe2\x80\xa6 https://t.co/PqPLccSdZu'"
1036829760775630848,2018-09-04 04:14:12,"b'RT @koblin: JUST IN: Ronan Farrow speaks: ""The suggestion to take the story to another outlet was first raised by NBC, not me, and I took t\xe2\x80\xa6'"
1036829210541735936,2018-09-04 04:12:01,b'The chairman of NBC News defended the news division\xe2\x80\x99s conduct and denied that Harvey Weinstein had influenced the n\xe2\x80\xa6 https://t.co/TApucNlL8K'
1036828290730876928,2018-09-04 04:08:22,"b'Barnacles may have a small footprint, but their effect on global shipping is large https://t.co/2ztJEVHzRN'"
1036824121861124096,2018-09-04 03:51:48,"b'The hall that held a 12,000-year-old skeleton known as Luzia, the oldest human remains discovered in the Americas,\xe2\x80\xa6 https://t.co/xhwQXfaZea'"
1036823219263754240,2018-09-04 03:48:13,"b'""As delightful as film festivals are in general, Venice stands out for many reasons"" https://t.co/G3VyQfPQMD'"
1036818663821770752,2018-09-04 03:30:07,b'President Trump suggested that the Justice Department should not have brought charges against 2 \xe2\x80\x9cvery popular\xe2\x80\x9d Repu\xe2\x80\xa6 https://t.co/CGOialL9K9'
1036815735962710022,2018-09-04 03:18:29,"b""RT @nytimesbusiness: China's self-made tech tycoons are the rock stars of the country's gilded age. The arrest of one of them in the United\xe2\x80\xa6"""
1036811578971246592,2018-09-04 03:01:58,b'An Old Sore for Mexico\xe2\x80\x99s Next President: The 43 Missing Students https://t.co/wyWRHw7UjV'
1036809354291359744,2018-09-04 02:53:07,b'Scared to be a parent? Fear not \xe2\x80\x94 there are books and consultants to help you figure out if you even want a child. https://t.co/6HQ5IXjqFm'
1036805264312287232,2018-09-04 02:36:52,"b""A 16-foot-tall sculpture of a black woman with braided hair will tower over the High Line's newest section. Its art\xe2\x80\xa6 https://t.co/z2A5LDQKRL"""
1036801042925670400,2018-09-04 02:20:06,"b'Colin Kaepernick has signed a multiyear deal with Nike that makes him a face of the 30th anniversary of the ""Just D\xe2\x80\xa6 https://t.co/KhGDmfa1C0'"
1036796012914991104,2018-09-04 02:00:06,"b'In hidden corners across South Korea, tiny cameras are surreptitiously recording thousands of women when they are a\xe2\x80\xa6 https://t.co/uh1a3JS2DN'"
1036792906462449665,2018-09-04 01:47:46,b'On Tennis: Naomi Osaka Emerges Victorious From Next-Generation Duel at U.S. Open https://t.co/sPeoi7P4ed'
1036790656469848065,2018-09-04 01:38:49,"b'\xe2\x80\x9cI\xe2\x80\x99ve thought this through and talked to colleagues \xe2\x80\x94 and I\xe2\x80\x99ve reconsidered,\xe2\x80\x9d David Remnick, the editor of The New\xe2\x80\xa6 https://t.co/b3Lt8vyfUj'"
1036789697220096000,2018-09-04 01:35:01,"b""Steve Bannon's appearance at the New Yorker Festival was canceled after several high-profile celebrities dropped ou\xe2\x80\xa6 https://t.co/iVy2jOducY"""
1036788478862925824,2018-09-04 01:30:10,"b'In offering civil rights protections to a new set of groups, the Justice Department has lifted protections for othe\xe2\x80\xa6 https://t.co/RKB1SOHOCc'"
1036781756194676736,2018-09-04 01:03:27,b'News Analysis: Pope Francis Embraces Silence as Calls Grow for Response to Allegations https://t.co/totD8Wzsuz'
1036778920148959233,2018-09-04 00:52:11,b'NBC News Boss Andrew Lack Defends Handling of Weinstein Story https://t.co/Rzyh41x152'
1036777072222527494,2018-09-04 00:44:51,"b""A 16-foot-tall sculpture of a black woman with braided hair will tower over the High Line's newest section. Its art\xe2\x80\xa6 https://t.co/AtkXrdvRdL"""
1036773211025956869,2018-09-04 00:29:30,"b'Casey Dills-Dailey, 38, was recovering from surgery. As her husband Wayne monitored the flooding, he also kept an e\xe2\x80\xa6 https://t.co/yHqMPPVwi3'"
1036772891512188933,2018-09-04 00:28:14,b'Second Insider Attack Kills Service Member in Afghanistan https://t.co/L1WeqqytlR'
1036772097333309440,2018-09-04 00:25:04,"b'Hurricane Harvey struck Houston just over a year ago. As the flooding overwhelmed the city\xe2\x80\x99s emergency systems, fam\xe2\x80\xa6 https://t.co/HqVgqMwWXG'"
1036768237923565568,2018-09-04 00:09:44,"b'Mourning McCain, and America https://t.co/TnfIqj25zn'"
1036767449641836545,2018-09-04 00:06:36,"b'Colin Kaepernick, Face of NFL Protests, Is Face of New Nike Campaign https://t.co/mw9RBLkdyn'"
1036767071777042432,2018-09-04 00:05:06,b'Recipe: One-pot Spanish-style shrimp and chorizo pasta https://t.co/esCkXHBdit'
1036762631477051392,2018-09-03 23:47:28,b'Trump Blasts Sessions for Charging G.O.P. Members Before Midterms https://t.co/6ElXscWRzH'
1036759762707329025,2018-09-03 23:36:04,b'The tech billionaire Vinod Khosla is willing to litigate the California coast for the rest of his life https://t.co/5z4yr4eNQ9'
1036757259223744513,2018-09-03 23:26:07,b'Argentina Takes Emergency Steps to Shore Up Peso https://t.co/46Gyr2pPG2'
1036753927893643265,2018-09-03 23:12:53,b'Was That Serena Williams in the Hotel Room Next to Mine? https://t.co/hRRUvju33M'
1036750457425879040,2018-09-03 22:59:05,b'RT @nytopinion: A strong civil society is one of the best defenders against extremism. So why are donors to Syrian civil society are withdr\xe2\x80\xa6'
1036743766718275597,2018-09-03 22:32:30,"b'Metropolitan Diary: \xe2\x80\x98Almost Magnetically, My Hand Was Drawn Into His\xe2\x80\x99 https://t.co/UvouRm498Q'"
1036743114088701953,2018-09-03 22:29:54,b'She Thought Pole Dancing at Kindergarten Was a Great Idea. Others Disagreed. https://t.co/h1NrTVyU91'
1036739838224084992,2018-09-03 22:16:53,"b'An abundance of research has shown that our clothes affect how other people perceive us, as well as how we see ours\xe2\x80\xa6 https://t.co/3rRYyS0J0F'"
1036735695564496901,2018-09-03 22:00:26,"b'Every summer, the most popular European destinations get stuffed to the gills with tourists, turning them into ""Dis\xe2\x80\xa6 https://t.co/kCAwY6FdbH'"
1036731508646715392,2018-09-03 21:43:47,"b""Looking for a new show to watch this weekend? We've got you covered. https://t.co/zr10mu7fmM"""
1036726991100227584,2018-09-03 21:25:50,b'Fringe Figures Find Refuge in Facebook\xe2\x80\x99s Private Groups https://t.co/vyAY1ibLYc'
1036724129205022720,2018-09-03 21:14:28,"b'""Not enough minority women have been groomed for senior writing jobs, a function not only of the industry\xe2\x80\x99s white m\xe2\x80\xa6 https://t.co/BqmfgHbOrD'"
1036719983974330369,2018-09-03 20:58:00,b'A police captain who told the court that the arrests of the Reuters journalists in Myanmar were a setup was punishe\xe2\x80\xa6 https://t.co/b9Ih16wnzy'
1036715704593068032,2018-09-03 20:40:59,"b""In the hours after Meghan McCain's eulogy, conservatives have debated whether it was appropriate for her to have us\xe2\x80\xa6 https://t.co/lHzvZp6puE"""
1036711393549008897,2018-09-03 20:23:52,"b'Asia and Australia Edition: Your Tuesday News Briefing: Myanmar, Richard Liu, Pole Dance https://t.co/hlEKQE2zK6'"
1036709424050696192,2018-09-03 20:16:02,"b'Two Malaysian women accused of pursuing a sexual relationship were caned in an Islamic court on Monday, setting off\xe2\x80\xa6 https://t.co/mBczLxwJBZ'"
1036707665207021570,2018-09-03 20:09:03,b'Amazon Sets Its Sights on the $88 Billion Online Ad Market https://t.co/LcIsFXpjNV'
1036707001932361728,2018-09-03 20:06:25,b'How Ukraine is Fighting Corruption One Heart Stent at a Time https://t.co/d6uknomCnW'
1036705433732493313,2018-09-03 20:00:11,"b'RT @NYTMetro: Over 10,000 workers marched across New York City during the first Labor Day parade in 1882. They held signs that called for ""\xe2\x80\xa6'"
1036701387239948289,2018-09-03 19:44:06,"b'Amtrak said service should be smoother after Labor Day, but N.J. Transit trains may be more crowded because of cons\xe2\x80\xa6 https://t.co/CgLMJmvEBD'"
1036697890960355328,2018-09-03 19:30:12,"b""How Venus and Serena (and other U.S. Open stars) sleep on long flights, and the things they'll never leave home wit\xe2\x80\xa6 https://t.co/sbxTAoYrJ7"""
1036694336522469376,2018-09-03 19:16:05,"b'""Two hundred years of work, research and knowledge have been lost,"" Michel Temer, the president of Brazil, tweeted https://t.co/uAbbLoZoCx'"
1036690344182722560,2018-09-03 19:00:13,"b'Though now many people associate Labor Day with barbecues and the beach, it started with calls for humane working c\xe2\x80\xa6 https://t.co/WQ2kqe2lcy'"
1036686525487083520,2018-09-03 18:45:03,"b""TV executives are hustling to diversify their writers' rooms, but the pipeline of experienced writers is thin. This\xe2\x80\xa6 https://t.co/7xqZC0gZEh"""
1036683010819670016,2018-09-03 18:31:05,b'How Brett Kavanaugh would transform the Supreme Court https://t.co/X7F7GNDb84 https://t.co/lnYEMIdzIR'
1036678992831676417,2018-09-03 18:15:07,"b'RT @nytopinion: The number of monarch butterflies in North American has dropped more than 80 percent in the last two decades. This year, it\xe2\x80\xa6'"
1036675287327690752,2018-09-03 18:00:23,"b'Is there a spy camera in that bathroom? In Seoul, 8,000 workers will check. https://t.co/i4gIwPlSd7 https://t.co/a1qdlIUJKo'"
1036671432409972737,2018-09-03 17:45:04,b'RT @nytmike: The lawyer at the center of the #Kavanaugh doc production is also the same lawyer who advised Don McGahn during his extensive\xe2\x80\xa6'
1036668168696225794,2018-09-03 17:32:06,"b""President Trump met a legal setback in moving to curb civil servants' unions. But agencies may be able to achieve t\xe2\x80\xa6 https://t.co/BdePo9APqc"""
1036663891911213060,2018-09-03 17:15:06,b'The internet in China lit up with video footage of a pole dancer at a Kindergarten in Shenzhen https://t.co/BjRexzxNyr'
1036660133957267459,2018-09-03 17:00:10,"b'Hospitals, hotels, technology companies and other businesses say they are struggling to fill jobs with the foreign\xe2\x80\xa6 https://t.co/CrrQR2odgQ'"
1036656346287022083,2018-09-03 16:45:07,"b'\xe2\x80\x9cCrazy Rich Asians\xe2\x80\x9d keeps getting richer, topping the North American box office for a third week in a row https://t.co/sviKiUpJZD'"
1036652810627174403,2018-09-03 16:31:04,"b'Defense officials told The Times that the military is considering closing military outposts in Tunisia, Cameroon, L\xe2\x80\xa6 https://t.co/PC4UbGoDHr'"
1036649277257379840,2018-09-03 16:17:02,"b""Stephen Bannon will headline The New Yorker Festival, where he will be interviewed by David Remnick, the magazine's\xe2\x80\xa6 https://t.co/IYoiaaB1Wa"""
1036644747249680384,2018-09-03 15:59:02,"b'The Sweden Democrats, a party with roots in Swedish fascism and neo-Nazism, is expected to get around 20% of votes\xe2\x80\xa6 https://t.co/S7dLfWFA0s'"
1036641486023155714,2018-09-03 15:46:04,"b""RT @nytopinion: Judge Brett Kavanaugh's nomination might not be as contentious as it is if the Supreme Court weren\xe2\x80\x99t so willing to insert i\xe2\x80\xa6"""
1036637198093832192,2018-09-03 15:29:02,"b'In Opinion\n\nOp-Ed columnist @DLeonhardt writes: ""The congressional Republicans inside the Washington National Cathe\xe2\x80\xa6 https://t.co/sR8vyk9aXz'"
1036633698240802817,2018-09-03 15:15:08,"b'Maria Butina\xe2\x80\x99s efforts to deal in Russian jet fuel involved David Keene, a former president of the NRA, and his wif\xe2\x80\xa6 https://t.co/51jqtrqZ28'"
1036629974214737925,2018-09-03 15:00:20,"b""Looking for something to nibble on while you're waiting at the grill? Here are our favorite summer cookout appetize\xe2\x80\xa6 https://t.co/kuxjLxhhwt"""
1036626142571241472,2018-09-03 14:45:06,"b""Chinese news outlets and social media users were consumed by details of Richard Liu's arrest. His mug shot, taken b\xe2\x80\xa6 https://t.co/xIwxGjEbaz"""
1036622620186292224,2018-09-03 14:31:06,"b'In many low-income neighborhoods around Houston, it feels like Harvey struck not last year but last month https://t.co/lwDHgzoowI'"
1036618339286695941,2018-09-03 14:14:06,"b'More than 20 million items were at risk in a fire at the National Museum of Brazil, a staggering cultural toll that\xe2\x80\xa6 https://t.co/3P5UIFClN2'"
1036614847973212160,2018-09-03 14:00:13,"b'The warring sides in Syria\xe2\x80\x99s long and merciless civil war are preparing for another brutal offensive, and this one\xe2\x80\xa6 https://t.co/iZR8PV1nze'"
1036611035145363456,2018-09-03 13:45:04,"b'When she found out there was a swastika on the church bell, Sigrid Peters refused to play the organ during services\xe2\x80\xa6 https://t.co/rKeho3pBrj'"
1036607281717231616,2018-09-03 13:30:09,"b'More than 100 alumni of a small, now-closed school for troubled teenagers have died in the span of a few years, oft\xe2\x80\xa6 https://t.co/sFVf8mx2Uq'"
1036603744270655488,2018-09-03 13:16:06,"b""In the hours after Meghan McCain's eulogy, conservatives have debated whether it was appropriate for her to have us\xe2\x80\xa6 https://t.co/5rsMPkwyHV"""
1036599733542895617,2018-09-03 13:00:10,"b""Days before the Supreme Court nominee's confirmation hearings, the Trump administration has decided to withhold tho\xe2\x80\xa6 https://t.co/yeRS6XjVs6"""
1036595686463029253,2018-09-03 12:44:05,b'A police captain who told the court that the arrests of the Reuters journalists in Myanmar were a setup was punishe\xe2\x80\xa6 https://t.co/tAAr0zOFqD'
1036592165647003648,2018-09-03 12:30:05,"b""Brian Kemp and Stacey Abrams, the Republican and Democrat in Georgia's gubernatorial race, are both trying to appea\xe2\x80\xa6 https://t.co/tOHTjTbDSf"""
1036588626228985856,2018-09-03 12:16:02,"b'""Two hundred years of work, research and knowledge have been lost,"" Michel Temer, the president of Brazil, tweeted https://t.co/7z7jdaHHpV'"
1036584644047724546,2018-09-03 12:00:12,"b""You may be off today, but here's your chance to learn about the work of a night-shift paramedic, an actor who portr\xe2\x80\xa6 https://t.co/mAGMsrWiZK"""
1036580436598775808,2018-09-03 11:43:29,b'Muslim Court Orders Malaysian Women Caned for Same-Sex Relationship https://t.co/evQSbmCpgf'
